{
  "id": "commercial",
  "lateral": { "b": 14.0, "c": 1.3, "d": 0.8, "e": -0.1 },
  "longitudinal": { "b": 12.0, "c": 1.55, "d": 0.86, "e": 0.2 },
  "load_sensitivity": 0.08,
  "fz0_n": 20000.0,
  "relaxation_length_m": 0.75,
  "rolling_resistance": 0.0065,
  "peak_slip_angle_rad": 0.179,
  "peak_slip_ratio": 0.145,
  "surface_multipliers": {
    "Asphalt": 1.0,
    "WetAsphalt": 0.68,
    "Concrete": 0.96,
    "Gravel": 0.7,
    "Grass": 0.45,
    "Dirt": 0.7,
    "Curb": 0.88,
    "Metal": 0.68,
    "PaintedLine": 0.95
  },
  "wear_rate": 4e-06
}
